URL,Title,Content
https://www.wevity.com/?c=find&s=1&mode=end&gbn=viewok&gp=1&ix=86266,제13회 한국아동·청소년패널 학술대회 연구계획서 공모,"제13회 한국아동·청소년패널 학술대회 연구계획서 공모■ 참가 부문 및 자격ㅇ 학술대회 일반 세션 발표 부문 - 대학교수 및 강사, 박사학위 소지자, 연구기관 연구원 등  * 학술대회 발표 시 소정의 발표수당 지급ㅇ 대학원생 논문 경진대회 부문 - 대학원 석·박사 과정 재학생 또는 휴학생(졸업예정자 포함) - 우수 논문 3편 선정 및 시상  * 시상내역 : 최우수상 1편(200만 원), 우수상 2편(각 100만 원)  * 우수 논문 3편은 학술대회 발표 필수(미발표 시 시상 제외)※ 세부 자격기준은 한국 아동·청소년·청년 데이터 아카이브 홈페이지→ 학술대회→ ‘신청자 자격기준’ 공지 참조■ 학술대회 주요 일정ㅇ 연구계획서 접수 : 4월 8일(월) ~ 4월 26일(금) ㅇ 연구계획서 제출 마감 : 4월 26일(금) 24:00까지 ㅇ 연구계획서 심사 및 결과 안내 : 5월 2일(목) ~ 5월 17일(금)ㅇ 최종 논문 접수 : 8월 19일(월) ~ 9월 20일(금)ㅇ 최종 논문 제출 마감 : 9월 20일(금) 24:00까지 ㅇ 최종 논문 심사 결과 통보 : 10월 4일(금)ㅇ 학술대회 개최 : 11월 15일(금)■ 연구계획서 제출 안내ㅇ 제출 서류 : 연구계획서 및 개인정보 동의서(홈페이지에서 다운받아 작성)    한국아동·청소년·청년데이터아카이브 홈페이지→ 학술대회 → 학술대회 공지 게시판의 ‘제13회 학술대회 안내’ 첨부 양식을 다운로드받아 작성 후 제출ㅇ 접수 기간 : 4월 8일(월) ~ 4월 26일(금)ㅇ 제출 마감 : 4월 26일(금) 24:00까지ㅇ 제출 방법 : 이메일 전송(kcyps@nypi.re.kr)■ 데이터 제공ㅇ KCYPS 2010 제1~7차(2010~2016년) 및 KCYPS 2018 제1~5차(2018~2022년) 조사 데이터 - 유저가이드, 설문지, 코드북, 데이터는 한국아동·청소년·청년 데이터 아카이브 홈페이지를 통해 상시 다운로드 가능ㅇ KCYPS 2018 제6차(2023년) 조사데이터 - 데이터 발송 예정일 : 5월 24일(금) 제공 예정 - 연구계획서 제출자 중 데이터 활용 보안서약서 제출자에 한하여 이메일로 발송(※최종 데이터는 학술대회 이후 공개 예정) - KCYPS 2018 제6차 데이터는 잠정 데이터로, 본 학술대회 용도로만 활용 가능■ 유의 사항ㅇ 학술대회 개최일 이전에 다른 곳에서 발표 또는 출간된 논문은 심사·발표 대상에서 제외됨ㅇ 최종 논문 원고는 학술논문으로서의 기본 요건을 충족해야 하며, 완성된 형태로 제출해야 함■ 문의/연락처ㅇ 데이터 및 학술대회 관련 문의 : kcyps@nypi.re.kr  ☎ 변주영 연구원 044-415-2205 ☎ 한지형 전문연구원 044-415-2244 ☎ 최인재 선임연구위원044-415-2102"
https://www.wevity.com/?c=find&s=1&mode=end&gbn=viewok&gp=1&ix=86267,제로 웨이스트 은평 쓰레기 줄이기 아이디어 공모전,"제로 웨이스트 은평 쓰레기 줄이기 아이디어 공모전■ 제출기간 : 2024. 4. 11.(목) ~ 5. 17.(금) <18:00까지 접수된 건에 한해 유효>■ 공모주제 : 생활 속 실천 가능한 쓰레기 줄이기 아이디어■ 제안분야 : 가정, 학교, 음식점, 직장 등 다양한 일상생활 속 감량 방법■ 제안내용- 생활 속에서 실천 가능한 쓰레기 감량 방법- 1회용품 대신 다회용품 사용률 제고 방법- 음식물쓰레기 발생 억제 방법- 버려지는 쓰레기 중 재활용 가능 쓰레기의 재활용률 제고 방법 등 공모 취지와 주제에 맞는 다양한 감량 방법■ 지원자격- 개  인 * 은평구 주민등록자- 팀 * 은평구에 주민등록된 2인 이상으로 구성된 팀 * 은평구에 주소를 둔 단체, 기관, 사업장※ 개인과 팀은 각각 별개 참가 주체로 봄■ 시상내역- 대상(1) : 2,000,000원- 최우수(1) : 1,000,000원- 우수(10) : 500,000원- 장려(20) : 100,000원■ 문의사항 : 은평구 자원순환과 청소행정팀 ☎ 02-351-7562 (이메일) greenmallard@ep.go.kr"
https://www.wevity.com/?c=find&s=1&mode=end&gbn=viewok&gp=1&ix=86269,제5회 으뜸인재 발굴대회 참가자 모집,"제5회 으뜸인재 발굴대회 참가자 모집■ 선발인원 : 70명(중·고·대학생 및 학교밖청소년) - 대학생의 경우 공고일 기준 휴학생은 선발 제외함- 학교급(중/고/대/학교밖) 구분하여 선발인원을 미리 정하지 않음■ 지원자격 : 공고일 기준 본인 또는 부(또는 모)가 전라남도에 주민등록을 두고 있으며 아래의 요건을 충족하는 자 ■ 선발분야 : 미래리더(4개 분과), 예체능리더(5개 분과)- (미 래) ①인문사회  ②자연과학  ③공학  ④마이스터 - (예체능) ①국악/실용음악  ②클래식  ③미술  ④무용/연기/영상  ⑤체육■ 모집공고 및 신청서 접수 : ‘24.4.5.(금)~5.10.(금)■ 지원내용) 맞춤형 재능계발비, 전라남도 인재증서 수여 등- (재능계발비) 1인당 연간 3~6백만원      * 중학생 : 3백만원 * 고등학생 : 5백만원 * 대학생 : 6백만원 * 학교밖 청소년 : 중‧고‧대 재학 나이에 맞춰 지급※ 재능계발비 사용내역(영수증 등 증빙서류 포함), 재능향상을 위한 활동내용 등 결과보고 의무있음■ 문의처 : 061-286-3422 / 061-285-9482"
https://www.wevity.com/?c=find&s=1&mode=end&gbn=viewok&gp=1&ix=86271,한국전력 KEPCO 프렌즈 11기 모집,"한국전력 KEPCO 프렌즈 11기 모집■ 기간 및 일정- 2024년 4월 16일 (화) ~ 5월 9일(목)■ 지원 대상- 한국전력에 관심이 많고, 멀티콘텐츠 제작에 익숙한 창의적인 대학생 (팀별로만 지원 가능) ■ 모집인원- 7개 팀(각 팀당 3~4명, 총 28명내외)■ 지원 자격- 국내 대학교 재(휴)학생으로 온·오프라인 활동이 가능한 자(전공무관)■ 선발 방식 - 서류, 콘텐츠 및 화상면접을 통해 최종 7팀 선발 ① 서류 및 콘텐츠 통합심사 ② 화상면접을 통한 적격 여부 심사■ 선발 일정 - 서류, 콘텐츠 제출: 2024년 4월 16일(화) ~ 5월 9일(목)- 화상면접: 2024년 5월 16일(목) ~ 5월 17일(금) (예정)※ 진행 상황에 따라 변경 가능(별도 통보 예정)■ 제출 자료 ① 팀 지원서, 개인정보 수집·이용동의서 (필수)② 영상 콘텐츠 기획안 및 결과물 (필수) - 영상 콘텐츠 주제: 한전의 과거·현재·미래③ 포트폴리오(선택 / 제출 시 심사 후 가점 부여)■ 최종 합격 팀 발표 - 2024년 5월 21일(화) ※개별 연락■ 지원 방법 - 한국전력 공식 블로그[굿모닝 KEPKO] 참고■ 활동 기간- 2024년 6월 ~ 9월 (4개월)■ 활동 내용 - 활동 주제 카테고리 내 주제에 대한 팀·개인별 콘텐츠 제작- (팀 미션) 영상 2건- (개인 미션) 카드뉴스/블로그 게시물 2건<활동 주제 카테고리>① 재무위기 극복② 기업체질 개선③ 성장동력 창출④ 국민기업 구현⑤ 안정적 전력공급 등 본원사업■ 대외활동 혜택- KEPCO 프렌즈 활동에 대한 원고료 및 활동비 지급- 활동 기준 충족 시수료증 발급- 우수활동팀 선정(1팀) · 사장상 수여 · 한전 입사 서류 심사 우대(대졸 공채 10% 서류 가점 또는 체험형 인턴 서류 면제)​■ 유의사항- 팀으로만 지원 가능합니다■ 문의- ﻿이메일 문의 : 2024kepcofriends@gmail.com"
https://www.wevity.com/?c=find&s=1&mode=end&gbn=viewok&gp=1&ix=86272,제 10회 대한민국민화대전 학생부(초/중/고등부) 작가 공모,"제 10회 대한민국민화대전 학생부(초/중/고등부) 작가 공모■ 응모자격 : 초∙중∙고등학생 및 그에 준하는 자격을 갖춘 자■ 공모 작품- 주    제 : 민화를 소재로 활용한 자유 주제- 바탕재료 : 종이- 규    격 : 4절지- 재    료 : 자유(제한 없음)■ 접수기간 : 2024. 5. 16(목) ~ 5. 24.(금) ※ 5월 20일(월) 휴관으로 방문접수 불가, 마감일 도착분에 한함■ 심사발표 : 2024. 6. 7.(금)■ 시    상 : 발송지로 개별 발송■ 전시기간 : 2024. 9. 3(화) ~ 12. 29(일)(4개월간)■ 출품수량 : 1인 1점■ 출 품 료 : 고등부문 - 1만원 / 초∙중등부문 - 5천원(농협 302-0894-2502-31 예금주 오석환)■ 참가신청 : 접수기간에 홈페이지에 접수방법 공지■ 공모전 출품방법 : 온라인 접수 후 작품 발송 및 출품료 입금※ 작품 뒷면에 지역, 학교, 학년, 이름, 작품명 기재 필수- 주    소 : (우 59263) 전남 강진군 대구면 청자촌길 61-5 ■ 제 출 물 : 개인정보가 기재된 작품 1점■ 유의사항 - 작품 뒷면에 출품자의 지역, 학교, 반, 성명, 작품명 미기재시 접수가 안될 수 있음.- 상장 제작을 위해 학교명은 학교홈페이지상의 정식명칭으로 기재바람.- 출품자는 미연에 발생할 수 있는 사고를 방지하기 위해 출품작품을 안전포장 요망.- 접수 이전의 운송 중 발생된 작품의 훼손에 대해서는 주최, 주관 측에서 일체 책임을 지지 않습니다.■ 시상내역구분고등 부문중등 부문초등 고학년 부문(4~6학년)초등 저학년 부문(1~3학년)비고대상전라남도지사 상장(30만원 상당 상품)전라남도지사 상장(10만원 상당 상품)전라남도지사 상장(10만원 상당 상품)전라남도지사 상장(10만원 상당 상품)각1명(4명)최우수상강진군수 상장(20만원 상당 상품)강진군수 상장(8만원 상당 상품)강진군수 상장(8만원 상당 상품)강진군수 상장(8만원 상당 상품)각2명(8명)우수상강진군의회의장 상장(10만원 상당 상품)강진군의회의장 상장(3만원 상당 상품)강진군의회의장 상장(3만원 상당 상품)강진군의회의장 상장(3만원 상당 상품)각3명(12명)장려상한국민화뮤지엄관장 상장(3 원 상당 상품)한국민화뮤지엄관장 상장(1.5만원 상당 상품)한국민화뮤지엄관장 상장(1.5만원 상당 상품)한국민화뮤지엄관장 상장(1.5만원 상당 상품)각10명(40명)특선한국민화뮤지엄관장 상장한국민화뮤지엄관장 상장한국민화뮤지엄관장 상장한국민화뮤지엄관장 상장각15명(60명)입선한국민화뮤지엄관장 상장(출품작의 30% 내외)■ 문의   - 공모전 담당자 (Tel. 061-433-9770~1, H.P 010-5118-4414, FAX 061-433-9772)"
https://www.wevity.com/?c=find&s=1&mode=end&gbn=viewok&gp=1&ix=86273,제10회 대한민국민화대전 일반부 작가 공모,"제10회 대한민국민화대전 일반부 작가 공모■ 공모 주제 및 작품규격- 주제: 제한없음- 바탕재료: 종이(한지), 천 등 제한없음- 규격: 자유- 재료: 자유※ 회화 작품만 접수 가능 (공예작품 접수 불가)■ 지원 자격- 성인(제한없음)■ 신청 기간- 신청기간: 2024년 6월 18일(화) ~ 2024년 6월 28일(금)- 수상작 발표 : 2024년 7월 12일(금) 한국민화뮤지엄 홈페이지에 공지- 시상식: 2024. 9. 3.(화) 14:00 제10회 대한민국민화대전 특별전 개막식장- 수상작 전시 : 2024년 9월 3일(화) ~ 2024년 12월 29일(일)■ 접수방법 및 제출 형식- 온라인 접수 후 작품 발송 및 출품료 입금- 참가신청: 접수 기간에 한국민화뮤지엄 홈페이지에 접수 방법 공지 ※ 단체출품의 경우, 첨부된 신청서 양식 작성 후 메일(minhwamuseum@daum.net)으로 발송- 출품방법: 뒷면에 개인정보가 기재된 작품 1점을 아래의 주소로 발송 ※ (우 59263) 전남 강진군 대구면 청자촌길 61-5 - 출품수량: 1인 최대 2점- 출품료: 1점 70,000원 / 2점 100,000원 ※ 농협 351-0559-9452-53 예금주 오석환■ 유의 사항- 작품 뒷면 우측 상단에 작가명, 연락처, 작품명 등 개인식별정보 기재 필수- 파손의 우려가 있는 작품은 접수 불가 (유리표구, 미배접 작품, 병풍 등)- 작품 앞면에 개인 낙관, 사인 등 심사에 영향을 줄 수 있는 표시 시 감점요인※ 기타 사항은 첨부된 상세요강을 참고해 주세요.■ 공모전 시상내역- 대상: 문화체육관광부장관 상장, 상금 1,000만원 - 1명- 최우수: 전라남도지사 상장, 상금 500만원 - 2명- 우수: 강진군수 상장, 상금 300만원 - 3명- 장려: 강진군의회 상장, 상품 증정 - 20명- 특선: 한국민화뮤지엄관장 상장 - 30명- 입선: 한국민화뮤지엄관장 상장 - 응모작의 30% 내외■ 문의 사항- 061-433-9770 / 010-5118-4414- minhwamuseum@daum.ne"
https://www.wevity.com/?c=find&s=1&mode=end&gbn=viewok&gp=1&ix=86274,[6주 만에 이모티콘 작가되기] 6기 참여자 모집,"[6주 만에 이모티콘 작가되기] 6기 참여자 모집6주 만에 이모티콘 제작을 배우고, 카카오톡 입점까지 도전해 보세요!이모티콘 작가되기 프로젝트 6기 참여자 모집■ 나도 이모티콘 한 번 만들어 볼까?“그림을 잘 못 그리는데… 괜찮을까?”“좋은 이모티콘 아이디어가 있는데, 어디서부터 시작해야 하지?”“드로잉을 배우는 것도 좋지만, 제안서 작성까지 가르쳐주는 강의는 없을까?”“기초부터 배워서 카카오톡 이모티콘 승인까지 도전해보고 싶어!”이 중 하나라도 내 이야기 같다고 느끼시는 분들께, [이모티콘 작가되기 프로젝트]를 추천해드립니다.이모티콘 작가되기! 글ego와 함께 도전해 보세요!■ 카톡 이모티콘, 이제 직접 만드세요!누구나 만들 수 있습니다!카카오톡 이모티콘을 만드는 데에는 학력도, 자격증도 필요하지 않습니다. 아이디어만으로도 누구나 도전해볼 수 있습니다.이제까지 다른 작가의 이모티콘을 사용하며 아쉬웠던 분이라면, 이제 직접 이모티콘을 만들고 제안서를 승인 받아 내가 만든 이모티콘으로 사람들과 대화를 나눠보세요.많은 사람들이 공감할 이모티콘을 만든다면 제2의 월급을 꿈꿔볼 수도 있습니다!■ 글ego 이모티콘 강의는 이렇게 다릅니다!■ 녹화 동영상 강의가 아닙니다!원활한 실습과 1:1 피드백을 위해 [이모티콘 작가되기 프로젝트]는 100% 실시간 온라인 강의로 진행됩니다. ■ 글ego 이모티콘 작가되기의 장점1. 6주 단기 완성   6주만에 빠르게 기초를 다지고 실전에 도전할 수 있습니다.2. 초보자 참여 가능   그림을 하나도 그릴 줄 모르는 초보자도 아이디어만 있다면 쉽게 참여할 수 있도록 기획되었습니다.3. 캐릭터 도안과 동작 시안 제공   이모티콘을 더욱 쉽게 만들 수 있도록 캐릭터 도안과 동작 시안을 제공합니다.4. 전문가의 1:1 피드백   애니메이션 감독 출신 강사님의 1:1 피드백을 통해, 이모티콘 제작을 위한 드로잉 실력을 획기적으로 향상시킬 수 있습니다.   ※ 원활한 실습과 1:1 피드백을 위해 100% 실시간 라이브 강의로 진행5. 제안서 작성 노하우 전수   이미 카카오톡에 이모티콘을 입점하고 있는 전문가로부터 제안서 작성 노하우를 전수받을 수 있습니다.■ 커리큘럼■ 강사 소개■ 강사의 말안녕하세요?이번 강의를 맡은 이지운 강사입니다.지난 3년 간 이모티콘 강의를 해오며 늘 강조했던 말이 있습니다.단순히 그림을 잘 그리는 것과 캐릭터를 창조하는 것은 다르다는 사실입니다. 특히나 이모티콘은 채팅창에서 이용자의 감정과 개성을 나타내 주는 역할이 큰 만큼 생동감 넘치고 살아 있는 캐릭터가 시장에서 선택 받을 가능성이 높습니다.저는 홍익대학교에서 애니메이션을 전공했습니다. 그렇기 때문에 누구보다 캐릭터를 만드는데 자신이 있습니다. 캐릭터의 표정과 감정, 상황 등을 어떻게 해야 잘 표현해낼 수 있는지에 대한 노하우가 있습니다. 한편으로 저는 직접 카카오톡에 이모티콘 판매 승인을 받기도 했습니다. 이러한 경험을 기반으로 저는 여러분들께 '팔리는 캐릭터'를 만드는 법을 알려드리고자 합니다.6주간의 여정을 함께 하며 발전을 거듭할 수강생 여러분의 모습이 기대됩니다. 밀착 피드백으로 실력은 키우고, 제안서 작성은 술술 써 내려갈 수 있도록 돕겠습니다.카카오톡 이모티콘 승인, 이제 여러분의 차례입니다. 수업에서 만나요!- 이지운 드림■ 참여 후기“이모티콘 만들기, 그걸 내가 할 수 있다고?”▷ 후기 보기 :  https://blog.naver.com/ddooooochi/223301389526 “카카오이모티콘 만들기 매주 후기”▷ 후기 보기 :  https://blog.naver.com/kwangsney/223351115112 “카카오 이모티콘 만들기 도전!”▷ 후기 보기 :  https://blog.naver.com/daybydaykorea/223352084352 ■ 실제 수강생 결과물■ 이런 분들께 추천합니다!- 다른 이모티콘을 보면서 ‘나도 만들 수 있겠다’ 싶은 분- 직접 만든 이모티콘으로 사람들과 소통하고 싶은 분- 머릿속 아이디어를 이모티콘으로 옮겨보고 싶은 분- 승인 받는 이모티콘 제작 노하우를 배워보고 싶은 분- 이모티콘을 만들어보고 싶지만 초보라 망설이는 분■ 수업 일정온라인 1타임 | 매주 화요일 7:00~8:50pm(4/30~6/4)1회차: 4월 30일 7:00~8:50pm2회차: 5월 7일 7:00~8:50pm3회차: 5월 14일 7:00~8:50pm4회차: 5월 21일 7:00~8:50pm5회차: 5월 28일 7:00~8:50pm6회차: 6월 4일 7:00~8:50pm※ ZOOM을 활용한 100% 실시간 온라인 강의로 진행합니다.■ 참여 비용 안내 60만 원 → 29만 원특별 할인 진행※ 특별 할인가, 추후에는 정상가격으로 진행될 수 있습니다.■ 신청 방법1. 신청서 작성 후 , 글ego 카카오톡 플러스 친구로 말씀을 남겨주세요.  (ex. 홍길동 / 이모티콘 만들기 신청했습니다.)2. 이후 안내에 따라 수강료를 입금하시면 신청이 완료됩니다.▷ 신청 링크 :  https://bit.ly/이모티콘_6기_신청하기 ■ 다음 강의 사전 신청 안내혹시 이번 강의 일정에 시간이 맞지 않으시다면, 다음에 오픈될 강의를 사전 신청해 주세요! 모집 오픈 시 따로 연락을 보내드릴 예정입니다.▷ 사전 신청 링크 :  https://bit.ly/이모티콘_6기_사전신청하기 ■ 문의하기프로그램 관련 궁금한 점이 있으신 경우, 글ego 카카오톡 채널로 문의주세요.▷ 글ego 채널 바로 가기 :  http://pf.kakao.com/_TUzfj/chat"
https://www.wevity.com/?c=find&s=1&mode=end&gbn=viewok&gp=1&ix=86275,2024 왕궁보석테마대표관광지 상설공연 가족소풍 서포터즈 모집,"2024 왕궁보석테마대표관광지 상설공연 가족소풍 서포터즈 모집■ 모집인원 : 5명 내외■ 모집대상 : 공고일 기준 전북 도내 거주자 및 도내 대학 재학생 (※ 도내 거주 증빙 또는 대학교 재학, 휴학, 졸업 증빙 가능자)■ 지원 및 혜택 (활동 70%이상 진행 시)- 예산지원 : 활동비 지원(추후 안내)- 공간지원 : 회의공간 지원(추후 협의)- 운영지원 : 활동을 위한 행정자료, 콘텐츠 소스 지원■ 접수기간 : 2024. 4. 16(화) ~ 2024. 4. 29.(월) 17:00 까지■ 접수방법- 제출방법 : 이메일 접수[adadcom@naver.com]- 제출자료 ① 서포터즈신청서 1부(붙임 1),  ② 개인정보 수집․이용동의서 1부(붙임 2) ③ 증빙서류(도내 거주지 확인이 가능한 서류, 대학 재학증명서 등 1부)■ 활동기간 : 2024년 5월 7일 ~ 11월 8일, 약 6개월 간 (※ 상황에 따라 활동기간 변동될 수 있음)■ 대외활동 내용- 2024 왕궁보석테마대표관광지 상설공연「가족소풍」활동 홍보- 2024 왕궁보석테마대표관광지 상설공연「가족소풍」SNS 콘텐츠 제작■ 선정방법 : 신청자격 적정 여부 검토 후 선정■ 선정발표 : 2024.5.2.(목) 개별통보 및 홈페이지 게재■ 오리엔테이션 : 2024.5.4.(토) 활동내용 및 필수사항 안내(온라인 진행)■ 문의 : 가족소풍운영사무국(☎063-253-7117) (※ 월~금 09:00~18:00)"
https://www.wevity.com/?c=find&s=1&mode=end&gbn=viewok&gp=1&ix=86277,2024 티앤크래프트페어 서포터즈 모집,"2024 티앤크래프트페어 서포터즈 모집■ 지원 자격- 차/공예에 관심 있으신 분- 블로그를 운영하고, SNS와 카페 활동을 활발하게 하시는 분- 활동 기간 중 미션을 성실하게 수행하실 분■ 모집 기간- 03.28(목) ~ 04.20(토) ■ 지원 방법- TEA서포터즈 OR CRAFT서포터즈 중 하나를 선택하여 teafair7705@naver.com으로 성함/연락처/주소/블로그주소/지원동기를 보내주세요~■ 대외활동 내용- 1~3차까지 블로그 포스팅 및 SNS, 카페활동 ■ 활동 혜택- TEA서포터즈: 공차 5만원 상품권 및 4일 프리패스권- CRAFT서포터즈: 스타벅스 5만원 상품권 및 4일 프리패스권"
