URL,Title,Content
https://www.wevity.com/?c=find&s=1&mode=end&gbn=viewok&gp=1&ix=86226,[금토링] 2024년 4월 금융권 취업 특강 참가자 모집,[금토링] 2024년 4월 금융권 취업 특강 참가자 모집■ 신청기간 : 4/1(월) ~ 4/26(금) 12:00까지■ 특강기간 : 4/27(토) ~ 4/28(일) 13:00-18:00■ 교육장소 : 서울시 강남 토즈 스터디센터■ 모집대상- 전국 정규대학(4년제) 4학년 재학생 및 졸업자- 휴학생의 경우 6학기 이상 수료자 限■ 지원방법 - https://forms.gle/j9PshQccBYtDBcZJ7- 구글 설문지 답변 후 제출( 제출 완료하면 담당자가 연락하여 추천자 전형으로 지원안내예정)※ 담당자 전형으로 조기에 신청하신 분들에게는 지원서 첨삭 및 면접TIP 안내를 제공 예정입니다.■ 특강내용- 금융권스펙관리- 자소서 첨삭- 면접전략소개- 포트폴리오 지도
https://www.wevity.com/?c=find&s=1&mode=end&gbn=viewok&gp=1&ix=86227,2024년 청소년 생명존중 공모전,"2024년 청소년 생명존중 공모전■ 참가자격: 대한민국 국민 누구나■ 공모부문: 손글씨, 카카오톡 이모티콘, 영상(숏폼)■ 접수 : 2024. 5. 31.(금) 24:00 / 공모작 메일 접수■ 제출서류- 생명존중 손글씨 * 참가 신청서 * 손글씨 파일([필수] JPG, PNG, PDF 등 / [선택] AI(일러스트))- 생명존중 카카오톡 이모티콘 * 참가 신청서 * PNG 21개 (투명배경), GIF 3개 (흰색배경)- 생명존중 영상(숏폼) * 참가 신청서(개인/단체), 촬영 및 초상권 활용 동의서(출연자 1명 당 1장) * 영상 파일(MP4(권장), AVI, MOV, WMV 중 택1)■ 시상내역- 최우수상 : 손글씨(1) 30만원 / 이모티콘(1) 100만원 / 숏폼(1) 50만원- 우수상 : 손글씨(3) 10만원 / 이모티콘(3) 50만원 / 숏폼(3) 30만원- 장려상 : 손글씨(5) 5만원 / 숏폼(5) 5만원■ 문의 : 02-2181-7419 / aramdan2181@naver.com"
https://www.wevity.com/?c=find&s=1&mode=end&gbn=viewok&gp=1&ix=86228,2024 한국은행 통화정책 경시대회,"2024 한국은행 통화정책 경시대회■ 참가신청 및 예심자료 제출 : 2024년 5월 20일(월)~5월 22일(수)■ 예심 결과 발표 : 6월 13일(목)~6월 14일(금) 중■ 지역예선대회 : 7월 17일(수)~7월 18일(목) 중 본부(서울) 및 지역본부(부산, 대구경북, 광주전남, 대전세종충남, 경기) 주관 개최**예심 결과에 따라 인근 지역으로 통합 개최 가능■ 전국결선대회 : 8월 9일(금, 잠정) 한국은행 본부 주관 개최 예정■ 참가대상 및 참가기준- 국내 대학(학부) 재학생 4명*이 1개 팀을 구성하여 참가 ※ 휴학 및 졸업 유보 중인 학생은 팀당 1인으로 제한 * 참가팀의 학교 간 연합팀 구성은 불허 * 예심의 경우 같은 학교 소속이더라도 다수 팀이 참가를 신청할 수 있으나, 지역예선대회 진출팀은 학교(캠퍼스)당 2개팀 이하로 선정 * 지역예선대회 이전까지 팀원 1인을 교체할 수 있으며 이 경우 대회 참가 경력은 최종적으로 팀을 구성한 4인에 대해서만 인정- 참가 신청 시 소속 지역은 학교(캠퍼스) 소재지를 기준으로 함■ 시상내역- 지역예선 및 전국결선대회 입상팀에 대해서는 한국은행 총재 표창장과 장학금을 수여 * 지역예선(팀당, 만원) : 최우수상 250, 우수상 200, 장려상 150 * 전국결선(팀당, 만원) : 금상 1,000, 은상 500, 동상 300, 장려상 100- 또한 동 대회에서 우수 성적자*는 향후 5년간 한국은행 신입직원 채용에 지원하는 경우 서류전형에서 우대 ※ 각 지역예선대회 최우수상 1팀 및 우수상 1팀의 팀원(팀당 4명)"
https://www.wevity.com/?c=find&s=1&mode=end&gbn=viewok&gp=1&ix=86230,케이리즈갤러리 제1회 신인작가 공모전,케이리즈갤러리 제1회 신인작가 공모전■ 응모대상- 타 갤러리에 소속되지 않은 모든 작가 (국적불문)■ 장르- 제한 없음■ 공모일정- 2024년 4월 1일(월)부터 4월 28일(일)까지■ 전시날짜- 2024년 중 개최(별도 협의)■ 심사방법- 1차 : 서류심사- 2차 : 인터뷰 (1차 심사 통과자)■ 제출서류 및 제출 방법 : 파일로 작성 후 gallerykliz@gmail.com으로 제출- 공모 신청서 1부 (하단 첨부파일 참조)- 출품작 작품 사진 또는 영상 (다양한 각도 및 세부촬영을 포함한 고해상도 파일로 제출하는 것을 권장)- 작가소개서 및 작품설명서- 포트폴리오 (작품 10점 내외)- 기타 첨부 자료 (관련 기사 및 참고 사진/영상 등)■ 선정자 발표 : 2024년 5월 중 발표- 1차심사 : 개별 통지- 2차심사 : 개별통지 및 갤러리 홈페이지 공지■ 안내사항- 부적절한 표절 및 그 밖의 결격 사항이 있을 때는 선정이 취소될 수 있음■ 관련 문의사항 : 이메일 문의 (gallerykliz@gmail.com)
https://www.wevity.com/?c=find&s=1&mode=end&gbn=viewok&gp=1&ix=86231,제6회 동학농민혁명 UCC 공모전,"제6회 동학농민혁명 UCC 공모전■ 공모내용 : 동학농민혁명의 세계사적 가치를 재조명하는 UCC  ※ 정읍시는 혁명의 가치를 드높이기 위해 매년 “세계혁명도시 연대회의”를 개최하고 있으며, 동학농민혁명 기록물이 2023년 5월 유네스코 세계기록유산에 등재되면서 동학농민혁명은 자랑스럽고 명예로운 세계 역사로 인정받고 있음■ 공모기간 : 2024. 3. 7.(목) ~ 2024. 4. 25.(목) / 50일간■  공모자격 및 출품 공모작 개수- 자 격 : 대한민국 국민 누구나(개인 또는 팀(단체) 참가 가능)- 출품 공모작 수 : 1개인(팀) 1편으로 제한■ 시상내역- 대  상 * 청소년부 : 1팀 / 3,000천원 * 대학·일반부 : 1팀 / 5,000천원- 최우수 * 청소년부 : 2팀 / 2,000천원 * 대학·일반부 : 2팀 / 3,000천원- 우  수 * 청소년부 : 2팀 / 1,000천원 * 대학·일반부 : 2팀 / 1,000천원- 장려상 * 청소년부 : 2팀 / 500천원 * 대학·일반부 : 2팀 / 500천원- 지도교사상 * 청소년부 : (4)명 / 1,000천원■ 문의 : 063-539-6932"
https://www.wevity.com/?c=find&s=1&mode=end&gbn=viewok&gp=1&ix=86232,괴산군장애인복지관 2024년 장애인식개선 작품 공모전,괴산군장애인복지관 2024년 장애인식개선 작품 공모전
https://www.wevity.com/?c=find&s=1&mode=end&gbn=viewok&gp=1&ix=86233,2024 제8회 천안 전국중창경연대회,"2024 제8회 천안 전국중창경연대회순수 아마추어 중창단 동호인들의 활동을 통해 시민과 함께 소통하며 지역 예술 발전 및 예술의 대중화에 기여함은 물론 예술의 가치를 추구하고 창작 예술의 사기를 진작시키고자하는 중창경연대회■ 지원 자격- 2인이상 15인 이하로 구성 된 동성,혼성 중창단 (전문직업 합창단원이 포함된 중창단은 제외)■ 모집 기간- 2024년 4월1일~6월8일. 18시마감■ 지원 방법- 우편접수(천안시 동남구 버들로 118, 동원빌딩2층 천안예총)- 이메일접수(tjwnstmdwns@naver.com)* 참가신청서(홈페이지 다운로드)와 참가악보 첨부 ■ 공모전 시상내역- 대상1팀 - 삼백만원- 금상1팀 - 일백만원- 은상1팀 - 칠십만원- 동상1팀 - 오십만원- 장려상2팀 - 각삼십만원- 특별상1팀 - 이십만원- 참가팀(수상팀제외) - 교통비 각십오만원■ 문의 사항- 041-561-1522"
https://www.wevity.com/?c=find&s=1&mode=end&gbn=viewok&gp=1&ix=86234,2024년 울산항만공사 광고 디자인·슬로건 공모전,2024년 울산항만공사 광고 디자인·슬로건 공모전■ 공모대상 : 울산항만공사에 관심 있는 사람 누구나(팀 참가는 4인 이하 제한) ■ 공모기간 : 2024. 4. 3.(수) ~ 2024. 4. 21.(일) 23:59■ 공모분야 : 울산항만공사 광고 디자인 또는 슬로건■ 시상내역- 최우수 * 광고 디자인 : 1점 / 300만원 * 슬로건 : 1점 / 100만원- 우수 * 광고 디자인 : 2점 / 100만원 * 슬로건 : 2점 / 50만원■ 문의: 울산항만공사 기획조정실 담당자(052-228-5357)
https://www.wevity.com/?c=find&s=1&mode=end&gbn=viewok&gp=1&ix=86235,제29회 대덕백일장,"제29회 대덕백일장■ 참가분야- 운문(시), 산문■ 작품규격- 운문(시) : 200자 원고지 5매 이내(1,000자 이내)- 산문 : 200자 원고지 10매 이내(2,000자 이내)■ 참가대상- 학생부 : 초등저(1~3학년)부, 초등고(4~6학년)부, 중등부, 고등부- 일반부 : 대학·일반부※ 글제: 행사 당일 발표■ 참가신청- 신청기간: 2024. 5. 18.(토)까지- 신청방법: 대덕문화원 홈페이지에서 온라인 신청■ 행사일시 및 장소- 행사일시 : 2024. 5. 18.(토) 10:30~14:00- 행사장소 : 동춘당 역사공원(대전 대덕구 동춘당로 90)※ 우천시, 대덕문화원(대전 대덕구 대전로 1348)   ■ 공모전 시상내역- 대상(대전시교육감상·대덕구청장상, 상품권 10만원, 5명)- 금상(대전시 동부 및 서부교육청장상·한남대 총장상·대덕구청장상, 상품권 5만원, 10명)- 은상(대전시 동부 및 서부교육청장상·한국문화원연합회장상·대덕구청장상, 상품권 3만원, 10명)- 동상(대전문화원연합회장상, 50여명)- 장려상(대덕문화원장상, 100여명)※ 수상자에게는 작품집을 함께 제공함※ 부문별 참가인원에 따라 시상인원은 변동될 수 있음■ 준비물- 필기구, 연습지, 물, 돗자리 등은 개인 준비※ 문화원 제공 : 대회용 200자 원고지 (운문 5매, 산문 10매)■ 입상자발표- 2024. 5. 31.(금) 대덕문화원 홈페이지 발표■ 문의처- 대덕문화원 042-627-7517"
https://www.wevity.com/?c=find&s=1&mode=end&gbn=viewok&gp=1&ix=86236,제2회 우울증 극복수기 공모전,"제 2회 우울증 극복수기 공모전■ 공모 주제1. 우울증을 조기에 발견하여 치료했던 이야기2. 우울증과 관련된 극복 경험 ( 본인, 가족, 지인 모두 가능)3. 그 외 우울증과 관련된 이야기■ 지원 자격- 우울증을 겪고 있는 사람 / 우울증 환우 가족 및 지인- 우울증 인식 개선에 대해 이야기 하고 싶은 누구나 참여 가능!■ 모집 기간- 2024.04.15 ~ 2024.05.19 (일)■ 공모전 시상내역- 최우수상 1명 50만원 상당 상품권- 우수상 1명 30만원 상당 상품권- 장려상 5명 10만원 상당 상품권- 참가상 참여자 전원 바나나 우유 1개■ 유의사항- 정확한 개인정보를 기입하지 않았을 경우, 선정 및 발송 과정에서 누락될 수 있습니다. - 경품 발송을 위해 이름, 연락처가 제3자에게 제공됩니다. (수집된 개인정보는 발송 후 폐기)- 본 이벤트는 대한신경정신의학회의 심사하에 선정됩니다.- 참여해주신 수기는 마케팅에 익명으로 일부 활용될 수 있습니다. - 1인당 1회 참여 가능합니다."
https://www.wevity.com/?c=find&s=1&mode=end&gbn=viewok&gp=1&ix=86238,제16회 옥천 짝짜꿍 전국 동요제,"제16회 옥천 짝짜꿍 전국 동요제■ 신청서 접수 : 2024년 4월 01일~4월25일(목)까지■ 예 선 심 사 : 2024년 4월 26일(금)(동영상 심사)■ 본       선 : 2024년 5월 17일(금) 오후 1시 00분~■ 장       소 : 37회 지용제 행사장 본 무대 ■ 참가자격- 전국 대상 유치부 및 초등학생- 참가부문 : 중창,합창으로 참가인원 2명 이상■ 참 가 곡- 참가곡은 자유곡 1곡이나 창작곡(옥천 상징 곡)- 자유곡은 동요에 한하며, 창작곡은 옥천의 특징을 잘 나타낸 곡으로 참가신청 후 임의로 변경할 수 없음- 옥천을 상징하는 내용의 창작동요 제출시 가산점 부여- 창작곡은 향후 정순철 기념사업회에 저작권이 있습니다.■ 시상내역- 대상(1팀)  상금 300만원 및 상패- 금상(1팀)  상금 150만원 및 상패- 은상(2팀)  상금  80만원 및 상패- 동상(3팀)  상금  50만원 및 상패- 장려상(3팀)  상금 30만원 및 상패- 특별상(4팀)  상금 20만원 및 상패"
https://www.wevity.com/?c=find&s=1&mode=end&gbn=viewok&gp=1&ix=86239,제4회 치매안심마을 어린이 공모전,"제4회 치매안심마을 어린이 공모전2021년 처음 개최하여 많은 관심을 받았던 치매안심마을 어린이 공모전이 올해 제4회로 진행됩니다.공모전을 통해 치매에 대한 부정적인 인식을 개선하고 우리 주변의 치매어르신에 대한 관심을 가질 수 있는 기회를 만들고자 합니다.공모주제 중 한 가지를 선택하여 여러분들의 생각을 그림으로 자유롭게 표현해주세요!■ 공모기간- 2024. 5. 1.(수)~5. 31.(금)■ 공모대상① 강서구 거주 초등학생② 강서구 내 초등학교 재학생 ⇒ 위의 ①, ② 중 하나 이상 해당하는 자■ 공모주제- 치매 어르신과 가족들이 살던 곳에서 이웃들과 안심하며 생활할 수 있는 마을을 표현해주세요.- 우리 동네, 내가 꿈꾸는 치매안심마을을 표현해주세요.- 치매 어르신을 위해 나는 무엇을 해줄 수 있을지 표현해주세요.- 치매 어르신과 가족을 배려할 수 있는 방법을 표현해주세요.■ 공모방법- 작품규격 : 8절지(272*394mm), 1인 1작품, 미술재료 제한 없음- 제출사항 : 신청서 및 동의서, 완성 작품 * 신청서 및 동의서는 양식 다운로드 후 작성- 제출방법 : 우편 또는 방문 제출 * 우편은 공모 마감 당일 소인분에 한함 * 주소:(07590) 서울시 강서구 화곡로 371, 3층 강서구치매안심센터 어린이 공모전 담당자 앞■ 시상내역- 대상(저학년부 1명/고학년부 1명) : 백화점상품권 20만원- 최우수상(저학년부 2명/고학년부 2명) : 백화점상품권 10만원- 우수상(저학년부 3명/고학년부 3명) : 백화점상품권 5만원- 장려상(저학년부 5명/고학년부 5명) : 백화점상품권 3만원※ 자세한 내용은 공모전사이트 참고■ 인증샷 이벤트- 강서구치매안심센터 유튜브 구독 및 인스타그램 팔로우 하고, 인증샷(그리는 모습 또는 완성작품과 함께 찍은 사진)과 학생이름, 연락처를 공모기간 내 강서구치매안심센터 인스타그램 다이렉트 메시지(DM)로 보내면 모바일상품권(3.000원) 6월 중 지급(작품 접수 필수)■ 결과발표 및 시상식- 2024. 07. 중, 강서구치매안심센터■ 문의사항- 강서구치매안심센터 이하윤 (02-3663-0943)"
https://www.wevity.com/?c=find&s=1&mode=end&gbn=viewok&gp=1&ix=86240,2024 대구 무장애관광 기획 공모전,2024 대구 무장애관광 기획 공모전
https://www.wevity.com/?c=find&s=1&mode=end&gbn=viewok&gp=1&ix=86241,2024 한국수자원조사기술원 제5기 서포터즈 모집,"2024 한국수자원조사기술원 제5기 서포터즈 모집■ 모집대상- 만 19세 이상 ~ 만 34세 이하 청년- 전국 대학생(재/휴학생)- 블로그 운영, 동영상 제작이 가능한 자- 서포터즈 활동에 적극 참여 가능한 자 - 발대식 등 공식 오프라인 행사에 참여 가능한 자 * 5월 7일(화) 발대식 필참■ 모집인원- 블로그: 3명_10장 이내 카드뉴스 제작 - 유튜브: 2명_3분 이내 가로형 영상 제작 ■ 활동내용- 월 평균 2건 이상 기사 포스팅 또는 월 1건 이상 동영상 제작- 기술원 및 추진 사업 홍보, 일상 관련 블로그 기사 및 영상 제작- 기술원 내외 행사 스케치, 인터뷰 등 현장취재 활동(월별 주제 제시)■ 활동기간- 2024년 5월 ~ 11월 (총 7개월)■ 모집일정- 2024년 4월 12일(금) ~ 4월 26일(금)23:59까지■ 선발 과정- 1차 서류전형 - 2차 비대면 면접 - 최종 발표* 1차 서류 합격자에 한해 2차 비대면 면접 진행■ 합격 발표- 2024. 05. 02(목) * 일정은 상황에 따라 변동될 수 있습니다.■ 대외활동 혜택- 기술원 서포터즈 월별 소정의 활동비- 기술원 서포터즈 위촉장 및 굿즈 증정- 기술원 서포터즈 활동 수료증 수여■ 오프라인 행사- 발대식(5월 7일_공식 행사 *필참)- 1차 팸투어(6월 예정_공식 행사 *필참)- 2차 팸투어(10월 예정_공식 행사 *필참)- 해단식(11월 예정_공식 행사 *필참)- 제주도(5월 9일 ~ 10일_선택 참여 일정)* 모든 참석 가능한 신청자를 우선 순위로 선발* 자세한 일정은 아래 17, 18번 항목 참조 바랍니다■ 문의- 서포터즈 5기 운영사무국- E-mail : shpark@imcapsule.com"
https://www.wevity.com/?c=find&s=1&mode=end&gbn=viewok&gp=1&ix=86242,사하 수필공모전,"사하 수필공모전부산의 강과 바다, 경이로운 일몰, 소박한 삶의 모양을 간직한 아름다운 사하. 사하구에서의 삶, 경험, 추억, 여행기 등 마음 한편에 간직한 여러분의 사하 이야기를 기다립니다!■ 공모대상 - 전 국민 누구나 ■ 공모주제 - 부산시 사하구 (사하구에서의 삶, 경험, 추억, 여행기 등) ■ 작품분량 - 지정 서식 2장 내외 ■ 공모일정 - 접수 : 2024. 4.24(수)~5.31(금) 17:00까지 - 발표 : 2024. 6.21(금) / 홈페이지 공지 및 개별 문자 발송 ■ 접수방법 - 부산스토리텔링협의회 홈페이지 접속 → 신청서 서식 다운로드 후 작성 → 이메일 접수 bsstory@storybusan.com ■ 시상내역 - 최우수상(1명) 상장, 상금 50만원 - 우수상(2명) 상장, 상금 30만원 - 장려상(3명) 상장, 상금 20만원 ■ 작품심사 - 사단법인 부산스토리텔링협의회 내·외부 심사위원단- 작품성, 지역성, 전달력, 차별성 등 종합 심사 ■ 유의사항- 수상작은 (사)부산스토리텔링협의회에서 발간하는 지역 스토리 잡지 《이야기 공작소 부산 : 3호[2024] 안녕한 사하》에 게재됨 - 응모는 1인 1작품, 개인 작품에 한함 - 지정 서식을 따르지 않거나 필수 정보 누락 시 심사에서 제외될 수 있음 - 출품작의 저작권은 응모자에게 있으나, 수상작에 한하여 제11회 부산스토리텔링축제 홍보 목적의 부차적 이용을 허락해야 함 - 표절작, 타 공모전 수상작, 유사 지원 사업 수상작, 타 매체 공개작 등은 응모 불가하며, 추후 이러한 내용이 밝혀질 경우 입상 취소 *더 자세한 사항은 부산스토리텔링협의회 홈페이지 공지사항 참고■ 문의처 - (사)부산스토리텔링협의회 051-505-2030"
https://www.wevity.com/?c=find&s=1&mode=end&gbn=viewok&gp=1&ix=86243,제11회 정지용 전국시낭송대회,"제11회 정지용 전국시낭송대회■ 참가대상- 일반부(만18세 이상 전국 남, 여 시낭송 애호가)※ 본 대회나 전국대회 대상수상자는 참가 제외(발견 시 수상을 박탈함)■ 접수방법- 기간: 2024. 03. 18.(월)~2024. 04. 19(금)- 방법: E-mail (마감당일 도착분만 인정)-서류 ① 참가신청서(붙임양식) 1부 ② 자유시낭송 녹음파일(메일 접수) 1개(4분이내)  ※1인 및 2인 이상 합송시 1팀도 가능 ③ 출품 시(詩) 원고 1부■ 시상내역- 대상(향수상) : 150만원 / 1명 / 상장 및 상금, 시낭송가 인증서- 금상(고향상) : 60 만원 / 1명 / 상장 및 상금, 시낭송가 인증서- 은상(호수상) : 30 만원 / 1명 / 상장 및 상금- 동상(홍시상) : 20 만원 / 1명 / 상장 및 상금- 장려상(석류상) : 10 만원 / 4명 / 상장 및 상금"
https://www.wevity.com/?c=find&s=1&mode=end&gbn=viewok&gp=1&ix=86244,2024 제4회 서울락스퍼국제영화제 자원봉사자 (서포터즈)모집,"2024 제4회 서울락스퍼국제영화제 자원봉사자 (서포터즈)모집■ 모집 개요자유와 정의, 인권의 가치를 수호하는 의미있는 영화축제이자 영화인들만의 잔치가 아닌 시민들과 함께하는 '자유의 문화'를 누리는 문화축제, 서울락스퍼국제영화제와 함께 할 자원봉사자를 모집합니다.■ 모집 대상- 만 18세 이상 성인 중 국내 거주자 (2005년 12월 31일생까지), (외국인도 지원 가능하나 한국어 의사소통이 원활해야 함)- 사전 교육을 비롯한 영화제 전 기간 참여 가능자■ 모집일정- 모집 기간 : 2024년 4월 15일~5월 20일- 1차 서류 발표 : 2024년 4월 30일 개별연락- 2차 서류 발표 : 2024년 5월 21일 개별연락- Zoom 면접 : 1차 혹은 2차 서류 심사에 통과한 지원자에 한해 날짜 및 시간 개별 안내- 사전 교육 : 줌 면접에 통과한 지원자에 한해 날짜 및 시간 개별 안내 (락스퍼사무국에서 진행)■활동 날짜 및 시간- 행사 기간 : 6월 5일~6월 9일 (행사 전 교육 프로그램 미포함)- 행사 시간 : 오전 10시~오후 6시 (시간은 개인에 따라 변동 가능하며 활동한 시간에 따라 봉사 시간 부여)■ 지원 방법- 구글 폼 신청서 작성 후 제출- https://forms.gle/mY6nBbGQZNT8EdKU7■ 모집 부문 및 활동내용- 통역팀 (외국인 손님 통역 및 안내 지원), (영어, 일본어, 우크라이나어, 러시아어)- 운영팀 (행사 설치 및 안내, 티켓 관리, 이벤트 지원)- 상영팀 (상영관 안내 및 운영, 게스트 안내 및 지원 등 행사 현장 지원)- 홍보팀 (영화제 홍보 지원 및 행사 지원)■ 대외활동 혜택- 봉사 시간 (하루 최대 8시간)- 자원활동가 활동복 지급- 자원활동가 아이디카드 지급- 식사 제공■ 유의사항- 합격 시 행사 전 교육 프로그램에 참석해야 합니다 (사전 교육 불참 시 활동이 불가).- 행사 중 중도 하차 및 시간 변경이 어려울 수 있습니다.- 행사 시간에 변동이 있을 수 있습니다. 시간 관리가 자유로우신 분들에 한해 지원해 주시길 바랍니다.■ 문의 사항- e-mail: larkspur@sliff.kr- TEL: 070-7007-5234"
https://www.wevity.com/?c=find&s=1&mode=end&gbn=viewok&gp=1&ix=86245,2024 알아가고 그려보는 장애인식개선 그림 공모전,"2024 알아가고 그려보는 장애인식개선 그림 공모전■ 참가대상1) 유아부: 2018년생 ~ 2020년생(5~7세)2) 초등부(저학년): 2015년생 ~ 2017년생(8~10세)■ 작품규격: 8절지, 자유형식 그림(디지털 드로잉 제외)■ 접수기간: 2024. 4. 15.(월) ~ 2024. 5. 31.(금)■ 시상내역- 통합대상(보건복지부장관상) : 1명 / 500,000원- 유아부 * 최우수상(한국장애인개발원장상) : 1명 / 300,000원 * 우수상(한국장애인단체총연합회 상임대표상) : 2명 / 150,000원- 초등부(저학년) * 최우수상(한국장애인고용공단 이사장상) : 1명 / 300,000원 * 우수상(한국장애인단체총연합회 상임대표상) : 2명 / 150,000원■ 주최·주관: 한국장애인단체총연합회■ 후원: 보건복지부, 한국장애인개발원, 한국장애인고용공단■ 문의사항: 대외협력팀 정윤정(070-7728-5744)"
https://www.wevity.com/?c=find&s=1&mode=end&gbn=viewok&gp=1&ix=86246,2024 광명시민 공익활동 슬로건 공모전,"2024 광명시민 공익활동 슬로건 공모전■ 공모 주제- 공익활동에 대한 이해 및 관심을 유도할 수 있는 슬로건■ 공모 내용- 공익활동에 대한 이해 및 관심을 유도할 수 있는 20자 이내의 슬로건과 200자 이상의 슬로건 설명■ 공모 목적- 공익활동에 대한 광명시민의 인식 확산 및 공익활동의 핵심가치 탐구유도- 공익활동에 대한 관심을 유도할 수 있는 슬로건 발굴■ 지원 자격- 공익활동에 있는 광명시민 누구나■ 모집 기간- 2024년 4월 9일(화)~4월 28일(일) 자정까지■ 공모전 시상내역- 총 100만원 상당 (온누리상품권 지급 예정)- 입상(10명): 10만원■ 지원 방법- 온라인 설문폼을 통한 접수,이메일 접수 또는 방문접수(1인1안) ① 온라인 설문폼 접수:https://url.kr/cxefjv ② 이메일 접수:응모신청서 및 개인정보 수집 활용 동의서 작성 후gmpublic@naver.com로 접수 ③ 방문접수:응모신청서 및 개인정보 수집 활용 동의서 작성 후 방문 접수- 출품 규격:공익활동에 대한 이해 및 관심을 유도할 수 있는슬로건(20자 이내)과 슬로건에 대한 설명(200자 이상) 제출■ 문의처- 광명시공익활동지원센터- 02-899-0900"
https://www.wevity.com/?c=find&s=1&mode=end&gbn=viewok&gp=1&ix=86247,동작구시설관리공단 ﻿제1차 주민참여 사진 공모전,동작구시설관리공단 ﻿제1차 주민참여 사진 공모전
